{
  "id": "thermal-v1",
  "version": 1,
  "display_name": "热与热管理工程",
  "description": "覆盖热源、传热、散热、热防护、环境控制和热安全的通用工程指导。",
  "stable_fields": [
    "id",
    "name",
    "description",
    "source",
    "confidence",
    "status",
    "assumptions",
    "relations"
  ],
  "extensions": {
    "pack_layer": "discipline",
    "reusable": true,
    "activation_terms": [
      "热管理",
      "散热",
      "传热",
      "温度",
      "热安全",
      "环境控制"
    ],
    "unknowns_are_first_class": true,
    "review_required_before_diagram": true
  },
  "core_overrides": [],
  "element_schemas": {
    "stakeholder": {
      "type": "object",
      "required": [
        "name",
        "category",
        "goals",
        "interactions"
      ],
      "properties": {
        "name": {
          "type": "string",
          "minLength": 1
        },
        "category": {
          "type": "string",
          "minLength": 1
        },
        "goals": {
          "type": "array",
          "items": {
            "type": "string",
            "minLength": 1
          }
        },
        "interactions": {
          "type": "array",
          "items": {
            "type": "string",
            "minLength": 1
          }
        },
        "concerns": {
          "type": "array",
          "items": {
            "type": "string"
          }
        }
      },
      "additionalProperties": true
    },
    "scenario": {
      "type": "object",
      "required": [
        "name",
        "trigger",
        "expected_outcome"
      ],
      "properties": {
        "name": {
          "type": "string",
          "minLength": 1
        },
        "trigger": {
          "type": "string",
          "minLength": 1
        },
        "expected_outcome": {
          "type": "string",
          "minLength": 1
        },
        "dimensions": {
          "type": "object"
        },
        "steps": {
          "type": "array",
          "items": {
            "type": "string"
          }
        },
        "hazards": {
          "type": "array",
          "items": {
            "type": "string"
          }
        }
      },
      "additionalProperties": true
    },
    "requirement": {
      "type": "object",
      "required": [
        "statement",
        "verification",
        "priority"
      ],
      "properties": {
        "statement": {
          "type": "string",
          "minLength": 1
        },
        "verification": {
          "type": "string",
          "minLength": 1
        },
        "priority": {
          "type": "string",
          "enum": [
            "must",
            "should",
            "could"
          ]
        },
        "rationale": {
          "type": "string"
        }
      },
      "additionalProperties": true
    },
    "component": {
      "type": "object",
      "required": [
        "name",
        "responsibilities",
        "interfaces"
      ],
      "properties": {
        "name": {
          "type": "string",
          "minLength": 1
        },
        "responsibilities": {
          "type": "array",
          "items": {
            "type": "string"
          }
        },
        "interfaces": {
          "type": "array",
          "items": {
            "type": "string"
          }
        }
      },
      "additionalProperties": true
    },
    "risk": {
      "type": "object",
      "required": [
        "name",
        "cause",
        "effect",
        "mitigations"
      ],
      "properties": {
        "name": {
          "type": "string",
          "minLength": 1
        },
        "cause": {
          "type": "string",
          "minLength": 1
        },
        "effect": {
          "type": "string",
          "minLength": 1
        },
        "mitigations": {
          "type": "array",
          "items": {
            "type": "string"
          }
        }
      },
      "additionalProperties": true
    }
  },
  "stakeholder_lenses": [
    {
      "id": "mission-user",
      "label": "任务使用者与热舒适/性能负责人"
    },
    {
      "id": "thermal-engineer",
      "label": "热设计、传热与仿真工程师"
    },
    {
      "id": "energy-system",
      "label": "能源、动力与设备系统工程师"
    },
    {
      "id": "operator-maintainer",
      "label": "运行、检查与维护人员"
    },
    {
      "id": "safety-environment",
      "label": "安全、环境与合规人员"
    },
    {
      "id": "material-manufacturing",
      "label": "材料、制造与供应方"
    }
  ],
  "lifecycle_phases": [
    {
      "id": "thermal-objectives",
      "label": "热负荷、边界与舒适目标定义"
    },
    {
      "id": "thermal-architecture",
      "label": "热源、路径、散热与隔热设计"
    },
    {
      "id": "model-test",
      "label": "模型、样机与环境试验"
    },
    {
      "id": "integration-verification",
      "label": "系统集成与热性能验证"
    },
    {
      "id": "operation-monitoring",
      "label": "运行监测、维护与热事件处置"
    },
    {
      "id": "degradation-disposal",
      "label": "老化、改造与热安全处置"
    }
  ],
  "scenario_dimensions": [
    {
      "id": "thermal_load",
      "label": "热负荷状态",
      "values": [
        "低",
        "额定",
        "峰值",
        "脉冲",
        "异常发热",
        "未知"
      ]
    },
    {
      "id": "ambient_context",
      "label": "环境条件",
      "values": [
        "常温",
        "高温",
        "低温",
        "潮湿",
        "低压",
        "风沙/腐蚀"
      ]
    },
    {
      "id": "heat_path",
      "label": "传热路径状态",
      "values": [
        "有效",
        "受限",
        "不均匀",
        "堵塞",
        "隔离",
        "反向热流"
      ]
    },
    {
      "id": "cooling_resource",
      "label": "冷却资源",
      "values": [
        "充足",
        "受限",
        "备用",
        "中断",
        "恢复中",
        "不可用"
      ]
    },
    {
      "id": "material_state",
      "label": "材料与部件状态",
      "values": [
        "新件",
        "热循环",
        "老化",
        "变形",
        "泄漏",
        "失效"
      ]
    },
    {
      "id": "thermal_safety",
      "label": "热安全状态",
      "values": [
        "正常",
        "预警",
        "热点",
        "超温",
        "隔离",
        "应急降温"
      ]
    }
  ],
  "coverage_rules": [
    {
      "id": "thermal-stakeholder-coverage",
      "source": "stakeholder_lenses",
      "priority": "high"
    },
    {
      "id": "thermal-lifecycle-coverage",
      "source": "lifecycle_phases",
      "priority": "high"
    },
    {
      "id": "load-ambient-cross",
      "source": "scenario_dimensions",
      "priority": "high"
    },
    {
      "id": "heat-path-cooling-cross",
      "source": "scenario_dimensions",
      "priority": "high"
    },
    {
      "id": "aging-and-monitoring",
      "source": "lifecycle_phases",
      "priority": "high"
    },
    {
      "id": "thermal-safety-evidence",
      "source": "stakeholder_lenses",
      "priority": "medium"
    }
  ],
  "prompt_fragments": {
    "stakeholders": "识别热负荷来源、系统负责人、热设计、操作维护、环境安全和制造供应角色。",
    "scenarios": "覆盖启动、稳态、峰值、环境变化、冷却受限、热点、超温、降级、应急降温和恢复。",
    "requirements": "把温度、梯度、热流、响应、舒适、效率、隔热、冷却、监测和热安全转为验证条件。",
    "architecture": "沿热源、传热路径、散热器、控制、传感、隔热、结构和环境接口展开。",
    "verification": "结合热网络、CFD/数值模型、样机、环境试验、传感数据和事件记录建立证据。",
    "safety": "考虑灼伤、热失控、材料退化、泄漏、冷却失效、热点扩展和错误处置。"
  },
  "diagram_groups": {
    "stakeholder_context": {
      "label": "利益相关方与系统边界",
      "order": 10
    },
    "scenario_flow": {
      "label": "场景、状态与流程",
      "order": 20
    },
    "functional_decomposition": {
      "label": "能力与功能分解",
      "order": 30
    },
    "logical_architecture": {
      "label": "逻辑架构与接口",
      "order": 40
    },
    "physical_architecture": {
      "label": "物理实现与部署",
      "order": 50
    },
    "traceability": {
      "label": "需求、验证与追溯",
      "order": 60
    }
  }
}
