{
  "id": "mechanical-v1",
  "version": 1,
  "display_name": "机械与结构工程",
  "description": "覆盖机构、结构、承载件、运动部件、封装和机械接口的通用工程学科指导。",
  "stable_fields": [
    "id",
    "name",
    "description",
    "source",
    "confidence",
    "status",
    "assumptions",
    "relations"
  ],
  "extensions": {
    "pack_layer": "discipline",
    "reusable": true,
    "activation_terms": [
      "机械",
      "结构",
      "机构",
      "承载",
      "装配",
      "公差",
      "部件"
    ],
    "unknowns_are_first_class": true,
    "review_required_before_diagram": true
  },
  "core_overrides": [],
  "element_schemas": {
    "stakeholder": {
      "type": "object",
      "required": [
        "name",
        "category",
        "goals",
        "interactions"
      ],
      "properties": {
        "name": {
          "type": "string",
          "minLength": 1
        },
        "category": {
          "type": "string",
          "minLength": 1
        },
        "goals": {
          "type": "array",
          "items": {
            "type": "string",
            "minLength": 1
          }
        },
        "interactions": {
          "type": "array",
          "items": {
            "type": "string",
            "minLength": 1
          }
        },
        "concerns": {
          "type": "array",
          "items": {
            "type": "string"
          }
        }
      },
      "additionalProperties": true
    },
    "scenario": {
      "type": "object",
      "required": [
        "name",
        "trigger",
        "expected_outcome"
      ],
      "properties": {
        "name": {
          "type": "string",
          "minLength": 1
        },
        "trigger": {
          "type": "string",
          "minLength": 1
        },
        "expected_outcome": {
          "type": "string",
          "minLength": 1
        },
        "dimensions": {
          "type": "object"
        },
        "steps": {
          "type": "array",
          "items": {
            "type": "string"
          }
        },
        "hazards": {
          "type": "array",
          "items": {
            "type": "string"
          }
        }
      },
      "additionalProperties": true
    },
    "requirement": {
      "type": "object",
      "required": [
        "statement",
        "verification",
        "priority"
      ],
      "properties": {
        "statement": {
          "type": "string",
          "minLength": 1
        },
        "verification": {
          "type": "string",
          "minLength": 1
        },
        "priority": {
          "type": "string",
          "enum": [
            "must",
            "should",
            "could"
          ]
        },
        "rationale": {
          "type": "string"
        }
      },
      "additionalProperties": true
    },
    "component": {
      "type": "object",
      "required": [
        "name",
        "responsibilities",
        "interfaces"
      ],
      "properties": {
        "name": {
          "type": "string",
          "minLength": 1
        },
        "responsibilities": {
          "type": "array",
          "items": {
            "type": "string"
          }
        },
        "interfaces": {
          "type": "array",
          "items": {
            "type": "string"
          }
        }
      },
      "additionalProperties": true
    },
    "risk": {
      "type": "object",
      "required": [
        "name",
        "cause",
        "effect",
        "mitigations"
      ],
      "properties": {
        "name": {
          "type": "string",
          "minLength": 1
        },
        "cause": {
          "type": "string",
          "minLength": 1
        },
        "effect": {
          "type": "string",
          "minLength": 1
        },
        "mitigations": {
          "type": "array",
          "items": {
            "type": "string"
          }
        }
      },
      "additionalProperties": true
    }
  },
  "stakeholder_lenses": [
    {
      "id": "system-user",
      "label": "系统使用者与任务负责人"
    },
    {
      "id": "mechanical-engineer",
      "label": "机械、结构与可靠性工程师"
    },
    {
      "id": "operator-maintainer",
      "label": "操作、维修与装配人员"
    },
    {
      "id": "manufacturing-quality",
      "label": "制造、工艺与质量团队"
    },
    {
      "id": "safety-regulatory",
      "label": "安全、法规与验证机构"
    },
    {
      "id": "material-supplier",
      "label": "材料、部件与工艺供应方"
    }
  ],
  "lifecycle_phases": [
    {
      "id": "mechanical-needs",
      "label": "载荷、运动与接口需求定义"
    },
    {
      "id": "concept-layout",
      "label": "方案、布局与机构概念"
    },
    {
      "id": "detail-design",
      "label": "详细设计、公差与材料选择"
    },
    {
      "id": "prototype-test",
      "label": "样机、试验与设计验证"
    },
    {
      "id": "production-service",
      "label": "制造、装配、维修与现场服务"
    },
    {
      "id": "life-end",
      "label": "升级、失效分析与拆解处置"
    }
  ],
  "scenario_dimensions": [
    {
      "id": "load_case",
      "label": "载荷工况",
      "values": [
        "静载",
        "循环",
        "冲击",
        "振动",
        "疲劳",
        "偶发极限"
      ]
    },
    {
      "id": "motion_state",
      "label": "运动状态",
      "values": [
        "静止",
        "定位",
        "连续运动",
        "往复",
        "高速",
        "卡滞/失控"
      ]
    },
    {
      "id": "environment",
      "label": "机械环境",
      "values": [
        "常温干燥",
        "潮湿",
        "腐蚀",
        "粉尘",
        "高低温",
        "冲击振动"
      ]
    },
    {
      "id": "interface_condition",
      "label": "接口条件",
      "values": [
        "名义",
        "偏差",
        "装配中",
        "磨损",
        "松脱风险",
        "不可用"
      ]
    },
    {
      "id": "tolerance_state",
      "label": "公差与变形",
      "values": [
        "受控",
        "累积",
        "热变形",
        "磨损",
        "超差",
        "待判定"
      ]
    },
    {
      "id": "failure_recovery",
      "label": "故障与恢复",
      "values": [
        "正常",
        "预警",
        "降级",
        "断裂/卡滞",
        "隔离",
        "更换修复"
      ]
    }
  ],
  "coverage_rules": [
    {
      "id": "mechanical-stakeholder-coverage",
      "source": "stakeholder_lenses",
      "priority": "high"
    },
    {
      "id": "mechanical-lifecycle-coverage",
      "source": "lifecycle_phases",
      "priority": "high"
    },
    {
      "id": "load-motion-cross",
      "source": "scenario_dimensions",
      "priority": "high"
    },
    {
      "id": "environment-tolerance-cross",
      "source": "scenario_dimensions",
      "priority": "high"
    },
    {
      "id": "maintenance-access",
      "source": "lifecycle_phases",
      "priority": "high"
    },
    {
      "id": "materials-and-human-safety",
      "source": "stakeholder_lenses",
      "priority": "medium"
    }
  ],
  "prompt_fragments": {
    "stakeholders": "识别承载、运动、装配、维修、制造、验证和使用角色，明确机械接口与责任边界。",
    "scenarios": "组合载荷、运动、环境、公差和故障状态，覆盖正常、极限、疲劳、卡滞、维修和恢复。",
    "requirements": "把强度、刚度、寿命、质量、运动、噪声、可装配、可维修和安全约束转为可验证需求。",
    "architecture": "从功能承载链到机构、结构、连接、封装和维护接口展开，记录假设与尺寸/材料依据。",
    "verification": "明确计算、仿真、样机、试验、检查和现场数据分别验证哪些特性。",
    "safety": "考虑断裂、脱落、夹伤、锐边、失稳、过载、误装和维修隔离。"
  },
  "diagram_groups": {
    "stakeholder_context": {
      "label": "利益相关方与系统边界",
      "order": 10
    },
    "scenario_flow": {
      "label": "场景、状态与流程",
      "order": 20
    },
    "functional_decomposition": {
      "label": "能力与功能分解",
      "order": 30
    },
    "logical_architecture": {
      "label": "逻辑架构与接口",
      "order": 40
    },
    "physical_architecture": {
      "label": "物理实现与部署",
      "order": 50
    },
    "traceability": {
      "label": "需求、验证与追溯",
      "order": 60
    }
  }
}
