{
  "id": "automotive-v1",
  "version": 1,
  "display_name": "道路车辆与移动出行系统",
  "description": "覆盖乘用车、商用车、特种车辆、车队服务和道路移动出行的通用 MBSE 指导。",
  "stable_fields": [
    "id",
    "name",
    "description",
    "source",
    "confidence",
    "status",
    "assumptions",
    "relations"
  ],
  "extensions": {
    "pack_layer": "industry",
    "reusable": true,
    "activation_terms": [
      "车辆",
      "道路",
      "驾驶",
      "出行",
      "车队",
      "自动驾驶",
      "交通"
    ],
    "unknowns_are_first_class": true,
    "review_required_before_diagram": true
  },
  "core_overrides": [],
  "element_schemas": {
    "stakeholder": {
      "type": "object",
      "required": [
        "name",
        "category",
        "goals",
        "interactions"
      ],
      "properties": {
        "name": {
          "type": "string",
          "minLength": 1
        },
        "category": {
          "type": "string",
          "minLength": 1
        },
        "goals": {
          "type": "array",
          "items": {
            "type": "string",
            "minLength": 1
          }
        },
        "interactions": {
          "type": "array",
          "items": {
            "type": "string",
            "minLength": 1
          }
        },
        "concerns": {
          "type": "array",
          "items": {
            "type": "string"
          }
        }
      },
      "additionalProperties": true
    },
    "scenario": {
      "type": "object",
      "required": [
        "name",
        "trigger",
        "expected_outcome"
      ],
      "properties": {
        "name": {
          "type": "string",
          "minLength": 1
        },
        "trigger": {
          "type": "string",
          "minLength": 1
        },
        "expected_outcome": {
          "type": "string",
          "minLength": 1
        },
        "dimensions": {
          "type": "object"
        },
        "steps": {
          "type": "array",
          "items": {
            "type": "string"
          }
        },
        "hazards": {
          "type": "array",
          "items": {
            "type": "string"
          }
        }
      },
      "additionalProperties": true
    },
    "requirement": {
      "type": "object",
      "required": [
        "statement",
        "verification",
        "priority"
      ],
      "properties": {
        "statement": {
          "type": "string",
          "minLength": 1
        },
        "verification": {
          "type": "string",
          "minLength": 1
        },
        "priority": {
          "type": "string",
          "enum": [
            "must",
            "should",
            "could"
          ]
        },
        "rationale": {
          "type": "string"
        }
      },
      "additionalProperties": true
    },
    "component": {
      "type": "object",
      "required": [
        "name",
        "responsibilities",
        "interfaces"
      ],
      "properties": {
        "name": {
          "type": "string",
          "minLength": 1
        },
        "responsibilities": {
          "type": "array",
          "items": {
            "type": "string"
          }
        },
        "interfaces": {
          "type": "array",
          "items": {
            "type": "string"
          }
        }
      },
      "additionalProperties": true
    },
    "risk": {
      "type": "object",
      "required": [
        "name",
        "cause",
        "effect",
        "mitigations"
      ],
      "properties": {
        "name": {
          "type": "string",
          "minLength": 1
        },
        "cause": {
          "type": "string",
          "minLength": 1
        },
        "effect": {
          "type": "string",
          "minLength": 1
        },
        "mitigations": {
          "type": "array",
          "items": {
            "type": "string"
          }
        }
      },
      "additionalProperties": true
    }
  },
  "stakeholder_lenses": [
    {
      "id": "driver-passenger",
      "label": "驾驶员、乘员与出行使用者"
    },
    {
      "id": "fleet-service",
      "label": "车队、调度、销售与服务运营方"
    },
    {
      "id": "vehicle-maintenance",
      "label": "维修、诊断与道路救援人员"
    },
    {
      "id": "road-regulatory",
      "label": "道路、交通、法规与保险机构"
    },
    {
      "id": "public-environment",
      "label": "行人、其他道路参与者与环境"
    },
    {
      "id": "supply-ecosystem",
      "label": "零部件、能源、数据与制造供应链"
    }
  ],
  "lifecycle_phases": [
    {
      "id": "mobility-need",
      "label": "出行任务与服务目标定义"
    },
    {
      "id": "vehicle-concept",
      "label": "车辆概念、平台与人因设计"
    },
    {
      "id": "system-development",
      "label": "系统开发、集成与验证"
    },
    {
      "id": "industrialization",
      "label": "量产准备、交付与培训"
    },
    {
      "id": "road-operation",
      "label": "道路运行、车队监控与维护"
    },
    {
      "id": "update-retirement",
      "label": "软件更新、事故处理与退役"
    }
  ],
  "scenario_dimensions": [
    {
      "id": "road_context",
      "label": "道路与交通环境",
      "values": [
        "城市",
        "高速",
        "乡村",
        "施工",
        "拥堵",
        "封闭道路",
        "非铺装"
      ]
    },
    {
      "id": "driving_mode",
      "label": "驾驶与自动化模式",
      "values": [
        "人工",
        "辅助",
        "自动",
        "接管请求",
        "降级",
        "最小风险状态"
      ]
    },
    {
      "id": "weather_visibility",
      "label": "天气与能见度",
      "values": [
        "正常",
        "夜间",
        "雨雪",
        "雾霾",
        "强光",
        "积水",
        "高温低温"
      ]
    },
    {
      "id": "vehicle_load",
      "label": "车辆负载与状态",
      "values": [
        "空载",
        "额定",
        "超常使用",
        "电量/燃料受限",
        "故障",
        "碰撞后"
      ]
    },
    {
      "id": "connectivity",
      "label": "车云路连接",
      "values": [
        "在线",
        "弱网",
        "延迟",
        "中断",
        "定位异常",
        "服务不可用"
      ]
    },
    {
      "id": "user_context",
      "label": "使用者状态",
      "values": [
        "熟悉",
        "陌生",
        "疲劳",
        "分心",
        "高压力",
        "多人协作"
      ]
    }
  ],
  "coverage_rules": [
    {
      "id": "automotive-stakeholder-coverage",
      "source": "stakeholder_lenses",
      "priority": "high"
    },
    {
      "id": "automotive-lifecycle-coverage",
      "source": "lifecycle_phases",
      "priority": "high"
    },
    {
      "id": "road-mode-weather-cross",
      "source": "scenario_dimensions",
      "priority": "high"
    },
    {
      "id": "connectivity-degradation",
      "source": "scenario_dimensions",
      "priority": "high"
    },
    {
      "id": "maintenance-and-update",
      "source": "lifecycle_phases",
      "priority": "high"
    },
    {
      "id": "vulnerable-road-users",
      "source": "stakeholder_lenses",
      "priority": "medium"
    }
  ],
  "prompt_fragments": {
    "stakeholders": "识别驾驶员、乘员、车队、维修、道路管理、其他道路参与者、监管、保险和供应链角色。",
    "scenarios": "覆盖出发、行驶、停车、充换能、故障、碰撞、接管、救援、更新和恢复场景，说明道路与用户上下文。",
    "requirements": "把出行目标转成可验证的安全、性能、舒适、可维护、网络安全和法规需求。",
    "architecture": "区分车辆本体、感知决策控制、能源、通信、云服务、道路基础设施和人工运营边界。",
    "diagnostics": "检查健康监测、故障诊断、维修授权、事件记录、远程更新和回滚路径。",
    "safety": "分析误操作、自动化边界、弱势道路参与者、通信/定位异常、动力和制动失效及事故后的安全状态。"
  },
  "diagram_groups": {
    "stakeholder_context": {
      "label": "利益相关方与系统边界",
      "order": 10
    },
    "scenario_flow": {
      "label": "场景、状态与流程",
      "order": 20
    },
    "functional_decomposition": {
      "label": "能力与功能分解",
      "order": 30
    },
    "logical_architecture": {
      "label": "逻辑架构与接口",
      "order": 40
    },
    "physical_architecture": {
      "label": "物理实现与部署",
      "order": 50
    },
    "traceability": {
      "label": "需求、验证与追溯",
      "order": 60
    }
  }
}
